{"$schema":"https://json-schema.org/draft/2020-12/schema","$id":"agents-runtime-evidence.schema.json","title":"Agents runtime release evidence","type":"object","required":["schema_version","workflow_version","repo_commit","source_commit","validated_content_digest","content_digest_excluded_paths","working_tree_status_at_capture","run_started_utc","run_finished_utc","duration_ms","commands","context_intelligence","claims","scope","xr_xw","evidence_tier","performance","result","release"],"properties":{"schema_version":{"const":"agents-runtime-evidence/v4"},"workflow_version":{"type":"string","pattern":"^\\d+\\.\\d+\\.\\d+$"},"repo_commit":{"type":"string","minLength":1},"source_commit":{"type":"string","minLength":1},"validated_content_digest":{"type":"object","required":["algorithm","value","intended_file_count"],"properties":{"algorithm":{"const":"sha256"},"value":{"type":"string","pattern":"^[a-f0-9]{64}$"},"intended_file_count":{"type":"integer","minimum":1}},"additionalProperties":true},"content_digest_excluded_paths":{"type":"array","minItems":1,"items":{"type":"string","minLength":1}},"working_tree_status_at_capture":{"type":"object","required":["state","porcelain","entry_count"],"properties":{"state":{"enum":["clean","dirty"]},"porcelain":{"type":"array","items":{"type":"string"}},"entry_count":{"type":"integer","minimum":0}},"additionalProperties":true},"run_started_utc":{"type":"string","format":"date-time"},"run_finished_utc":{"type":"string","format":"date-time"},"duration_ms":{"type":"integer","minimum":0},"commands":{"type":"array","minItems":8,"items":{"type":"object","required":["name","command","result","exit_code","duration_ms","retry_count","raw_output_ref"],"properties":{"name":{"type":"string","minLength":1},"command":{"type":"string","minLength":1},"result":{"enum":["passed","failed"]},"exit_code":{"type":"integer"},"duration_ms":{"type":"integer","minimum":0},"retry_count":{"type":"integer","minimum":0},"raw_output_ref":{"type":"string","minLength":1},"overall_score":{"type":["number","null"]}},"additionalProperties":true}},"context_intelligence":{"type":"object","required":["captured","resolver_schema","practice_report_schema","runtime_report_ref","result"],"properties":{"captured":{"type":"boolean"},"resolver_schema":{"const":"agents-context-evidence/v1"},"practice_report_schema":{"enum":["agents-context-practice-report/v1","not_run"]},"runtime_report_ref":{"const":".agents/runtime/context-intelligence/practice-report.json"},"result":{"enum":["pass","failed","not_run"]},"baseline":{"type":"object","required":["version","source_commit","method","runs_per_task"],"properties":{"version":{"const":"2.8.0"},"source_commit":{"type":"string","pattern":"^[a-f0-9]{40}$"},"method":{"type":"string","minLength":1},"runs_per_task":{"const":3}},"additionalProperties":true},"candidate":{"type":"object","required":["version","method","runs_per_task"],"properties":{"version":{"const":"2.9.0"},"method":{"type":"string","minLength":1},"runs_per_task":{"const":3}},"additionalProperties":true},"metrics":{"type":"object","required":["task_accuracy","critical_impact_recall","impact_precision","baseline_context_median_bytes","candidate_context_median_bytes","context_median_reduction","baseline_tool_calls_median","candidate_tool_calls_median","tool_call_reduction","fallback_pass_rate"],"properties":{"task_accuracy":{"type":"number","minimum":0,"maximum":1},"critical_impact_recall":{"type":"number","minimum":0,"maximum":1},"impact_precision":{"type":"number","minimum":0,"maximum":1},"baseline_context_median_bytes":{"type":"integer","minimum":1},"candidate_context_median_bytes":{"type":"integer","minimum":1},"context_median_reduction":{"type":"number","minimum":0,"maximum":1},"baseline_tool_calls_median":{"type":"number","exclusiveMinimum":0},"candidate_tool_calls_median":{"type":"number","minimum":0},"tool_call_reduction":{"type":"number","minimum":0,"maximum":1},"fallback_pass_rate":{"type":"number","minimum":0,"maximum":1}},"additionalProperties":false},"thresholds":{"type":"object","required":["task_accuracy","critical_impact_recall","impact_precision","context_median_reduction","tool_call_reduction","fallback_pass_rate","deterministic"],"properties":{"task_accuracy":{"const":true},"critical_impact_recall":{"const":true},"impact_precision":{"const":true},"context_median_reduction":{"const":true},"tool_call_reduction":{"const":true},"fallback_pass_rate":{"const":true},"deterministic":{"const":true}},"additionalProperties":false},"fallback_tests":{"type":"array","minItems":6,"maxItems":6,"items":{"type":"object","required":["state","result"],"properties":{"state":{"enum":["stale","degraded","unsupported","parse_error","conflict","dirty"]},"result":{"const":"pass"}},"additionalProperties":true}},"scope":{"type":"object","required":["practice_level","external_pilot","codegraph_runtime"],"properties":{"practice_level":{"const":"T2 current-repo practice"},"external_pilot":{"const":"not executed"},"codegraph_runtime":{"const":"not installed or used"}},"additionalProperties":true}},"allOf":[{"if":{"properties":{"captured":{"const":true}},"required":["captured"]},"then":{"required":["baseline","candidate","metrics","thresholds","fallback_tests","scope"],"properties":{"practice_report_schema":{"const":"agents-context-practice-report/v1"},"result":{"const":"pass"}}}}],"additionalProperties":true},"claims":{"type":"object","required":["static_validation","runtime_evidence","practice_evidence","context_intelligence","evidence_tier","hard_isolation","external_pilot_boundary"],"additionalProperties":true},"scope":{"type":"object","required":["target","external_target_deployment","external_pilot","codegraph_runtime","raw_output_storage","practice","disposable_target"],"additionalProperties":true},"xr_xw":{"type":"object","required":["external_reads","external_writes"],"properties":{"external_reads":{"type":"array"},"external_writes":{"type":"array"}},"additionalProperties":true},"evidence_tier":{"type":"object","required":["current","maximum_claimed","scale"],"additionalProperties":true},"performance":{"type":"object","required":["command_count","total_duration_ms","token_usage","token_usage_reason"],"additionalProperties":true},"result":{"enum":["passed","failed"]},"release":{"type":"string","pattern":"^v\\d+\\.\\d+\\.\\d+$"}},"additionalProperties":false}
