{"schema_version":"agents-runtime-evidence/v4","workflow_version":"2.9.0","repo_commit":"1c2d7ca02fce38950a4a3b78c2ab98e1f8bcf843","source_commit":"1c2d7ca02fce38950a4a3b78c2ab98e1f8bcf843","validated_content_digest":{"algorithm":"sha256","value":"8bb1efc1568b6282e75768d2ea43a9aaa92836acb20b58f81f7fe580fcdcb7e1","intended_file_count":178},"content_digest_excluded_paths":[".git/**",".agents/runtime/**",".workflow/**",".codex/**","docs/evidence/releases/*.json","docs/evidence/raw/**"],"working_tree_status_at_capture":{"state":"dirty","porcelain":["M  .agents/skills/project-isolation-workflow/SKILL.md","M  AGENTS.md","M  CHANGELOG.md","M  README.md","M  docs/agents/ai-runtime.yaml","M  docs/agents/context-compact.yaml","A  docs/agents/context-intelligence.yaml","M  docs/agents/deploy.yaml","M  docs/agents/knowledge-footprint.yaml","M  docs/agents/runtime-execution.yaml","M  docs/agents/schemas.yaml","M  docs/agents/verify.yaml","M  docs/agents/version.yaml","M  docs/agents/workflows.yaml","D  docs/evidence/releases/v2.8.0-runtime-evidence.json","A  docs/evidence/releases/v2.9.0-runtime-evidence.json","M  docs/memory-entry.template.md","M  docs/memory/entries/2026-05-28-verify-chinese-trigger-text.md","M  docs/memory/index.md","M  docs/runbooks/agents-operator-guide.md","M  docs/templates/agents/AGENTS.md","M  docs/templates/agents/agents-operator-guide.md","M  docs/templates/agents/agents/ai-runtime.yaml","M  docs/templates/agents/agents/context-compact.yaml","A  docs/templates/agents/agents/context-intelligence.yaml","M  docs/templates/agents/agents/deploy.yaml","M  docs/templates/agents/agents/knowledge-footprint.yaml","M  docs/templates/agents/agents/runtime-execution.yaml","M  docs/templates/agents/agents/schemas.yaml","M  docs/templates/agents/agents/verify.yaml","M  docs/templates/agents/agents/version.yaml","M  docs/templates/agents/agents/workflows.yaml","M  docs/templates/agents/memory-entry.template.md","M  docs/templates/agents/memory-index.md","M  docs/templates/agents/project-memory.md","M  docs/templates/agents/skills/project-isolation-workflow/SKILL.md","M  schemas/agents-ai-runtime.schema.json","M  schemas/agents-context-compact.schema.json","A  schemas/agents-context-evidence.schema.json","A  schemas/agents-context-intelligence.schema.json","M  schemas/agents-deploy.schema.json","M  schemas/agents-knowledge-footprint.schema.json","M  schemas/agents-runtime-evidence.schema.json","M  schemas/agents-runtime-execution.schema.json","M  schemas/agents-schemas.schema.json","M  schemas/agents-verify.schema.json","M  schemas/agents-version.schema.json","M  schemas/agents-workflows.schema.json","M  scripts/README.md","M  scripts/agents-runtime.ps1","M  scripts/capture-runtime-evidence.ps1","M  scripts/export-release-package.ps1","A  scripts/resolve-agent-context.ps1","A  scripts/test-context-intelligence.ps1","M  scripts/validate-changes.ps1","A  scripts/validate-context-intelligence.ps1","M  scripts/validate-evidence-templates.ps1","M  scripts/validate-knowledge.ps1","M  scripts/validate-release-evidence.ps1","M  scripts/validate-required-files.ps1","M  scripts/validate-runtime-execution.ps1","M  scripts/validate-score.ps1","M  scripts/validate.ps1","M  tests/agents-governance-fixtures/schema-contracts/workflows.valid.yaml","A  tests/context-intelligence/cases.json"],"entry_count":65},"run_started_utc":"2026-08-06T04:10:27.9231704Z","run_finished_utc":"2026-08-06T04:14:33.2273515Z","duration_ms":245304,"commands":[{"name":"deployment_self_test","command":".\\scripts\\deploy-agents-workflow.ps1 -SelfTest -Quiet","result":"passed","exit_code":0,"duration_ms":39674,"retry_count":0,"raw_output_ref":"%TEMP%/codex-agent-status/jared-s-ai-team-269f185848e5/runtime-evidence-20260806T041027Z-0bb867bd/deployment_self_test.log"},{"name":"current_project_dry_run","command":".\\scripts\\deploy-agents-workflow.ps1 -TargetPath . -Mode template_provider_mode -LayoutProfile auto -DryRun -Quiet","result":"passed","exit_code":0,"duration_ms":1819,"retry_count":0,"raw_output_ref":"%TEMP%/codex-agent-status/jared-s-ai-team-269f185848e5/runtime-evidence-20260806T041027Z-0bb867bd/current_project_dry_run.log"},{"name":"disposable_target_rollback_drill","command":".\\scripts\\deploy-agents-workflow.ps1 -SelfTest -Quiet","result":"passed","exit_code":0,"duration_ms":44161,"retry_count":0,"raw_output_ref":"%TEMP%/codex-agent-status/jared-s-ai-team-269f185848e5/runtime-evidence-20260806T041027Z-0bb867bd/disposable_target_rollback_drill.log"},{"name":"runtime_lifecycle_smoke","command":".\\scripts\\validate-runtime-execution.ps1","result":"passed","exit_code":0,"duration_ms":559,"retry_count":0,"raw_output_ref":"%TEMP%/codex-agent-status/jared-s-ai-team-269f185848e5/runtime-evidence-20260806T041027Z-0bb867bd/runtime_lifecycle_smoke.log"},{"name":"release_package_export","command":".\\scripts\\export-release-package.ps1 -OutputPath %TEMP%/codex-agent-status/\u003cproject-id\u003e/\u003crun-id\u003e/release-package -Quiet","result":"passed","exit_code":0,"duration_ms":1645,"retry_count":0,"raw_output_ref":"%TEMP%/codex-agent-status/jared-s-ai-team-269f185848e5/runtime-evidence-20260806T041027Z-0bb867bd/release_package_export.log"},{"name":"route_pack_deterministic","command":".\\scripts\\validate-route-pack.ps1","result":"passed","exit_code":0,"duration_ms":456,"retry_count":0,"raw_output_ref":"%TEMP%/codex-agent-status/jared-s-ai-team-269f185848e5/runtime-evidence-20260806T041027Z-0bb867bd/route_pack_deterministic.log"},{"name":"context_intelligence_practice","command":".\\scripts\\test-context-intelligence.ps1 -Quiet","result":"passed","exit_code":0,"duration_ms":34866,"retry_count":0,"raw_output_ref":"%TEMP%/codex-agent-status/jared-s-ai-team-269f185848e5/runtime-evidence-20260806T041027Z-0bb867bd/context_intelligence_practice.log"},{"name":"full_validation","command":".\\scripts\\validate-changes.ps1 -Profile Full -ContextMode Required -Score","result":"passed","exit_code":0,"duration_ms":120956,"retry_count":0,"raw_output_ref":"%TEMP%/codex-agent-status/jared-s-ai-team-269f185848e5/runtime-evidence-20260806T041027Z-0bb867bd/full_validation.log","overall_score":100.0,"evidence_capture_mode":"runtime-evidence-bootstrap"}],"context_intelligence":{"captured":true,"resolver_schema":"agents-context-evidence/v1","practice_report_schema":"agents-context-practice-report/v1","runtime_report_ref":".agents/runtime/context-intelligence/practice-report.json","result":"pass","baseline":{"version":"2.8.0","source_commit":"8a2d46adf19d2ede1ca5cc5aff880ca5a4cc2a61","method":"Replay canonical v2.8 route-expansion files without reading v2.9 context evidence.","runs_per_task":3},"candidate":{"version":"2.9.0","method":"Live agents-context-evidence/v1 resolver execution.","runs_per_task":3},"metrics":{"task_accuracy":1,"critical_impact_recall":1,"impact_precision":0.875,"baseline_context_median_bytes":53657,"candidate_context_median_bytes":5376,"context_median_reduction":0.8998,"baseline_tool_calls_median":5,"candidate_tool_calls_median":1,"tool_call_reduction":0.8,"fallback_pass_rate":1},"thresholds":{"task_accuracy":true,"critical_impact_recall":true,"impact_precision":true,"context_median_reduction":true,"tool_call_reduction":true,"fallback_pass_rate":true,"deterministic":true},"fallback_tests":[{"state":"stale","result":"pass"},{"state":"degraded","result":"pass"},{"state":"unsupported","result":"pass"},{"state":"parse_error","result":"pass"},{"state":"conflict","result":"pass"},{"state":"dirty","result":"pass"}],"scope":{"practice_level":"T2 current-repo practice","external_pilot":"not executed","codegraph_runtime":"not installed or used"}},"claims":{"static_validation":"Full validation covers repository contracts, schema checks, package checks, and release evidence.","runtime_evidence":"Runtime evidence is captured from repeatable local commands.","practice_evidence":"T2 current-repo practice suite captured.","context_intelligence":"Live v2.9 context resolver A/B and fallback practice passed.","evidence_tier":"T2 current-repo practice","hard_isolation":"No hard isolation claim is made without current runtime, tool, OS, account, or cloud enforcement evidence.","external_pilot_boundary":"No external project pilot was executed for this release evidence."},"scope":{"target":"current repository and disposable self-test target","external_target_deployment":false,"external_pilot":"not executed","codegraph_runtime":"not installed or used","raw_output_storage":"%TEMP%/codex-agent-status/\u003cproject-id\u003e/\u003crun-id\u003e/","practice":true,"disposable_target":"deployment self-test temporary targets only"},"xr_xw":{"external_reads":[],"external_writes":["%TEMP%/codex-agent-status/\u003cproject-id\u003e/\u003crun-id\u003e/ raw command logs and release package scratch"]},"evidence_tier":{"current":"T2 current-repo practice","maximum_claimed":"T2 current-repo practice","scale":["T0 static","T1 dry-run","T2 current-repo practice","T3 external pilot","T4 enforced isolation"]},"performance":{"command_count":8,"total_duration_ms":245304,"token_usage":"unavailable","token_usage_reason":"Repository validation scripts do not receive Codex token accounting."},"result":"passed","release":"v2.9.0"}
